{
  "architecture_mode": "single_agent",
  "experiment_id": "E3-manager-star-v1",
  "model_alias": "gpt-5.6-terra",
  "negative_ref_manifest_sha256": "e49456d7e1a50ce558a3bdfc955d74cf3583dc03c9a8ed562a837acbdba54cdc",
  "paired_target_ref": "quant/E3-T3-R2-M1",
  "protocol_version": "1.0.0-rc2",
  "provider_base_url": "https://api.openai.com/v1",
  "provider_identity_sha256": "f5712a84b16c220abf9b470e0a5df839b9cdf3f2be4386989c2e4b18f9086cdc",
  "provider_mode": "openai",
  "public_inputs_sha256": {
    "task_inputs/financial_returns_v1.csv": "1b0830f2077cb2a70cd094c6e879702d8dcea0fa4e07152b533e8c9cb005df61"
  },
  "rag_enabled": false,
  "replicate": 2,
  "retrieval_context_included": false,
  "role_budgets": null,
  "rubric_sha256": "d55e2203461c2d044f62c00d7677bc0d9b1a5f2c3d7a660742a94adba4541c79",
  "run_key": "E3-T3-R2-M0",
  "runtime_limits": {
    "cpu_vcpus": 2,
    "memory_mb": 4096,
    "pids_limit": 256,
    "timeout_seconds": 1800
  },
  "sandbox_profile_sha256": "e1d83459b29ab25be0bac50e0fc65c5754dd341491e995699bc3d13a6f4c25e8",
  "schema_version": "exp3-run-identity-v2",
  "shared_budget": {
    "max_calls": 15,
    "max_tokens": 200000
  },
  "source_commit": "d22af8748c152be865bd854a222875fdf8bdd10d",
  "source_ref": "exp3/terra-source-v6",
  "status": "draft_local_only",
  "target_ref": "quant/E3-T3-R2-M0",
  "task_id": "T3",
  "task_text_sha256": "65e516426f991493ed4efe9be60eae6ccc5acf786533f74c71df3aa53a683919",
  "tool_implementation_sha256": "9676f0bb716dcdc5ee64e24aaf5f2dc1972fd2e99113546f8b103bba1dd87769"
}
