{
  "architecture_mode": "single_agent",
  "experiment_id": "E3-manager-star-v1",
  "model_alias": "gpt-5.6-terra",
  "negative_ref_manifest_sha256": "4f681a0a1fb683984c31ec0457e89c357b1adfb13e97c1781cb7a725cf93924a",
  "paired_target_ref": "quant/E3-T1-R2-M1",
  "protocol_version": "1.0.0-rc2",
  "provider_base_url": "https://api.openai.com/v1",
  "provider_identity_sha256": "f5712a84b16c220abf9b470e0a5df839b9cdf3f2be4386989c2e4b18f9086cdc",
  "provider_mode": "openai",
  "public_inputs_sha256": {},
  "rag_enabled": false,
  "replicate": 2,
  "retrieval_context_included": false,
  "role_budgets": null,
  "rubric_sha256": "d55e2203461c2d044f62c00d7677bc0d9b1a5f2c3d7a660742a94adba4541c79",
  "run_key": "E3-T1-R2-M0",
  "runtime_limits": {
    "cpu_vcpus": 2,
    "memory_mb": 4096,
    "pids_limit": 256,
    "timeout_seconds": 1800
  },
  "sandbox_profile_sha256": "4d831bc38de3389ea1a0bf0f7d1777a0cf5fde7d1274d9d8887442d98f41bb5d",
  "schema_version": "exp3-run-identity-v2",
  "shared_budget": {
    "max_calls": 15,
    "max_tokens": 200000
  },
  "source_commit": "0fc9756bec0e12216c5c1b0120dc734de5e68928",
  "source_ref": "exp3/terra-source-v3",
  "status": "draft_local_only",
  "target_ref": "quant/E3-T1-R2-M0",
  "task_id": "T1",
  "task_text_sha256": "bfa2181b565dc530e694b594b1af005d6669e4209fa959fbeb21a84904550fbd",
  "tool_implementation_sha256": "02d6a12734edd6f978e0be66cc5ddacf7ead9cbebd0b3e2492bb2498dc41b202"
}
