{
  "architecture_mode": "single_agent",
  "experiment_id": "E3-manager-star-v1",
  "model_alias": "gpt-5.6-terra",
  "negative_ref_manifest_sha256": "e706c2f4feded81833709a2a3bd61396c5d5bfc51b50047e0b77a10fd1b4cff7",
  "paired_target_ref": "quant/E3-T1-R1-M1",
  "protocol_version": "1.0.0-rc2",
  "provider_base_url": "https://api.openai.com/v1",
  "provider_identity_sha256": "f5712a84b16c220abf9b470e0a5df839b9cdf3f2be4386989c2e4b18f9086cdc",
  "provider_mode": "openai",
  "public_inputs_sha256": {},
  "rag_enabled": false,
  "replicate": 1,
  "retrieval_context_included": false,
  "role_budgets": null,
  "rubric_sha256": "d55e2203461c2d044f62c00d7677bc0d9b1a5f2c3d7a660742a94adba4541c79",
  "run_key": "E3-T1-R1-M0",
  "runtime_limits": {
    "cpu_vcpus": 2,
    "memory_mb": 4096,
    "pids_limit": 256,
    "timeout_seconds": 1800
  },
  "sandbox_profile_sha256": "29947f9cbe87740922839479b2b7876a54523f9a82357decf70fa82c56c5d341",
  "schema_version": "exp3-run-identity-v2",
  "shared_budget": {
    "max_calls": 15,
    "max_tokens": 200000
  },
  "source_commit": "9df73f041e0530fd018ea16cc4491a08a456b2db",
  "source_ref": "exp3/terra-source-v2",
  "status": "draft_local_only",
  "target_ref": "quant/E3-T1-R1-M0",
  "task_id": "T1",
  "task_text_sha256": "bfa2181b565dc530e694b594b1af005d6669e4209fa959fbeb21a84904550fbd",
  "tool_implementation_sha256": "6c021f1fb2f9bcaf59eddda2c7b90b437a615375bf76b252163ce253759414fb"
}
